{
  "schemaVersion": 2,
  "contentRevision": "ws-content-r2.1",
  "domain": "research",
  "records": [
    {
      "id": "RS-D01-SAMPLE",
      "costId": "RCOST-RS-D01-SAMPLE",
      "sourceDocumentId": "RESEARCH-001",
      "enabled": true,
      "minimumDay": 1,
      "prerequisiteText": "D1, C01 단서",
      "comparisonInput": "환경/광물 서로 다른 2개",
      "cost": {
        "general": 4,
        "metal": 0,
        "signal": 0,
        "specialist": 0
      },
      "durationSeconds": 30,
      "unlockText": "표본 PDC 판독, FAC-P03·P04",
      "stateMachine": [
        "HIDDEN",
        "OBSERVABLE",
        "HYPOTHESIZED",
        "READY",
        "QUEUED",
        "PROCESSING",
        "PAUSED",
        "ANALYZED",
        "UNLOCKED",
        "MASTERED"
      ],
      "raw": [
        "RS-D01-SAMPLE",
        "D1, C01 단서",
        "환경/광물 서로 다른 2개",
        "4/0/0/0, 30초",
        "표본 PDC 판독, FAC-P03·P04"
      ]
    },
    {
      "id": "RS-D03-SEPARATION",
      "costId": "RCOST-RS-D03-SEPARATION",
      "sourceDocumentId": "RESEARCH-001",
      "enabled": true,
      "minimumDay": 3,
      "prerequisiteText": "D3, C03",
      "comparisonInput": "오염 전후 1쌍+광물 1",
      "cost": {
        "general": 6,
        "metal": 2,
        "signal": 0,
        "specialist": 0
      },
      "durationSeconds": 45,
      "unlockText": "기초 분리·정화 필터",
      "stateMachine": [
        "HIDDEN",
        "OBSERVABLE",
        "HYPOTHESIZED",
        "READY",
        "QUEUED",
        "PROCESSING",
        "PAUSED",
        "ANALYZED",
        "UNLOCKED",
        "MASTERED"
      ],
      "raw": [
        "RS-D03-SEPARATION",
        "D3, C03",
        "오염 전후 1쌍+광물 1",
        "6/2/0/0, 45초",
        "기초 분리·정화 필터"
      ]
    },
    {
      "id": "RS-D05-DOCTRINE-I",
      "costId": "RCOST-RS-D05-DOCTRINE-I",
      "sourceDocumentId": "RESEARCH-001",
      "enabled": true,
      "minimumDay": 5,
      "prerequisiteText": "D5, 일반 전략 2종 관측",
      "comparisonInput": "역할 2종+패턴 기록 2",
      "cost": {
        "general": 4,
        "metal": 2,
        "signal": 2,
        "specialist": 0
      },
      "durationSeconds": 60,
      "unlockText": "일반 적군 교리 Lv1~2",
      "stateMachine": [
        "HIDDEN",
        "OBSERVABLE",
        "HYPOTHESIZED",
        "READY",
        "QUEUED",
        "PROCESSING",
        "PAUSED",
        "ANALYZED",
        "UNLOCKED",
        "MASTERED"
      ],
      "raw": [
        "RS-D05-DOCTRINE-I",
        "D5, 일반 전략 2종 관측",
        "역할 2종+패턴 기록 2",
        "4/2/2/0, 60초",
        "일반 적군 교리 Lv1~2"
      ]
    },
    {
      "id": "RS-D07-FIELD-REPAIR",
      "costId": "RCOST-RS-D07-FIELD-REPAIR",
      "sourceDocumentId": "RESEARCH-001",
      "enabled": true,
      "minimumDay": 7,
      "prerequisiteText": "D7, 장비 손상·수리",
      "comparisonInput": "성공/실패 수리 기록",
      "cost": {
        "general": 8,
        "metal": 4,
        "signal": 0,
        "specialist": 0
      },
      "durationSeconds": 50,
      "unlockText": "야전 수리 키트 효율, BROKEN 판독",
      "stateMachine": [
        "HIDDEN",
        "OBSERVABLE",
        "HYPOTHESIZED",
        "READY",
        "QUEUED",
        "PROCESSING",
        "PAUSED",
        "ANALYZED",
        "UNLOCKED",
        "MASTERED"
      ],
      "raw": [
        "RS-D07-FIELD-REPAIR",
        "D7, 장비 손상·수리",
        "성공/실패 수리 기록",
        "8/4/0/0, 50초",
        "야전 수리 키트 효율, BROKEN 판독"
      ]
    },
    {
      "id": "RS-D09-RESONANCE",
      "costId": "RCOST-RS-D09-RESONANCE",
      "sourceDocumentId": "RESEARCH-001",
      "enabled": true,
      "minimumDay": 9,
      "prerequisiteText": "D9, C08",
      "comparisonInput": "공진 표본 2출처",
      "cost": {
        "general": 4,
        "metal": 2,
        "signal": 6,
        "specialist": 0
      },
      "durationSeconds": 75,
      "unlockText": "Day 10 신호 오차 범위, FAC-P06",
      "stateMachine": [
        "HIDDEN",
        "OBSERVABLE",
        "HYPOTHESIZED",
        "READY",
        "QUEUED",
        "PROCESSING",
        "PAUSED",
        "ANALYZED",
        "UNLOCKED",
        "MASTERED"
      ],
      "raw": [
        "RS-D09-RESONANCE",
        "D9, C08",
        "공진 표본 2출처",
        "4/2/6/0, 75초",
        "Day 10 신호 오차 범위, FAC-P06"
      ]
    },
    {
      "id": "RS-D11-NEURAL",
      "costId": "RCOST-RS-D11-NEURAL",
      "sourceDocumentId": "RESEARCH-001",
      "enabled": true,
      "minimumDay": 11,
      "prerequisiteText": "D11, C10",
      "comparisonInput": "생체 2역할+침묵 관측",
      "cost": {
        "general": 6,
        "metal": 4,
        "signal": 4,
        "specialist": 2
      },
      "durationSeconds": 80,
      "unlockText": "신경성 상태 도감·해독제",
      "stateMachine": [
        "HIDDEN",
        "OBSERVABLE",
        "HYPOTHESIZED",
        "READY",
        "QUEUED",
        "PROCESSING",
        "PAUSED",
        "ANALYZED",
        "UNLOCKED",
        "MASTERED"
      ],
      "raw": [
        "RS-D11-NEURAL",
        "D11, C10",
        "생체 2역할+침묵 관측",
        "6/4/4/2, 80초",
        "신경성 상태 도감·해독제"
      ]
    },
    {
      "id": "RS-D13-TOXIN",
      "costId": "RCOST-RS-D13-TOXIN",
      "sourceDocumentId": "RESEARCH-001",
      "enabled": true,
      "minimumDay": 13,
      "prerequisiteText": "D13, 해독 실험",
      "comparisonInput": "BEFORE_AFTER 2쌍",
      "cost": {
        "general": 8,
        "metal": 2,
        "signal": 2,
        "specialist": 4
      },
      "durationSeconds": 90,
      "unlockText": "독·출혈 정화 우선순위",
      "stateMachine": [
        "HIDDEN",
        "OBSERVABLE",
        "HYPOTHESIZED",
        "READY",
        "QUEUED",
        "PROCESSING",
        "PAUSED",
        "ANALYZED",
        "UNLOCKED",
        "MASTERED"
      ],
      "raw": [
        "RS-D13-TOXIN",
        "D13, 해독 실험",
        "BEFORE_AFTER 2쌍",
        "8/2/2/4, 90초",
        "독·출혈 정화 우선순위"
      ]
    },
    {
      "id": "RS-D15-DOCTRINE-II",
      "costId": "RCOST-RS-D15-DOCTRINE-II",
      "sourceDocumentId": "RESEARCH-001",
      "enabled": true,
      "minimumDay": 15,
      "prerequisiteText": "D15, 교리 I",
      "comparisonInput": "전략 4종+정예 기록",
      "cost": {
        "general": 6,
        "metal": 4,
        "signal": 8,
        "specialist": 4
      },
      "durationSeconds": 100,
      "unlockText": "일반 교리 Lv3~5, 보스 교리 Lv1",
      "stateMachine": [
        "HIDDEN",
        "OBSERVABLE",
        "HYPOTHESIZED",
        "READY",
        "QUEUED",
        "PROCESSING",
        "PAUSED",
        "ANALYZED",
        "UNLOCKED",
        "MASTERED"
      ],
      "raw": [
        "RS-D15-DOCTRINE-II",
        "D15, 교리 I",
        "전략 4종+정예 기록",
        "6/4/8/4, 100초",
        "일반 교리 Lv3~5, 보스 교리 Lv1"
      ]
    },
    {
      "id": "RS-D18-JAMMING",
      "costId": "RCOST-RS-D18-JAMMING",
      "sourceDocumentId": "RESEARCH-001",
      "enabled": true,
      "minimumDay": 18,
      "prerequisiteText": "D18, C12",
      "comparisonInput": "구조·공진 2축",
      "cost": {
        "general": 8,
        "metal": 6,
        "signal": 8,
        "specialist": 6
      },
      "durationSeconds": 110,
      "unlockText": "시설 방해 경고·차폐 모듈",
      "stateMachine": [
        "HIDDEN",
        "OBSERVABLE",
        "HYPOTHESIZED",
        "READY",
        "QUEUED",
        "PROCESSING",
        "PAUSED",
        "ANALYZED",
        "UNLOCKED",
        "MASTERED"
      ],
      "raw": [
        "RS-D18-JAMMING",
        "D18, C12",
        "구조·공진 2축",
        "8/6/8/6, 110초",
        "시설 방해 경고·차폐 모듈"
      ]
    },
    {
      "id": "RS-D20-AMALGAM",
      "costId": "RCOST-RS-D20-AMALGAM",
      "sourceDocumentId": "RESEARCH-001",
      "enabled": true,
      "minimumDay": 20,
      "prerequisiteText": "D20, BOSS-002 결과",
      "comparisonInput": "보스 표본+구조 성공/실패",
      "cost": {
        "general": 6,
        "metal": 8,
        "signal": 10,
        "specialist": 6
      },
      "durationSeconds": 120,
      "unlockText": "신경 접합 대응 도감, 부품 B 판독",
      "stateMachine": [
        "HIDDEN",
        "OBSERVABLE",
        "HYPOTHESIZED",
        "READY",
        "QUEUED",
        "PROCESSING",
        "PAUSED",
        "ANALYZED",
        "UNLOCKED",
        "MASTERED"
      ],
      "raw": [
        "RS-D20-AMALGAM",
        "D20, BOSS-002 결과",
        "보스 표본+구조 성공/실패",
        "6/8/10/6, 120초",
        "신경 접합 대응 도감, 부품 B 판독"
      ]
    },
    {
      "id": "RS-D21-MOBILE-PURIFY",
      "costId": "RCOST-RS-D21-MOBILE-PURIFY",
      "sourceDocumentId": "RESEARCH-001",
      "enabled": true,
      "minimumDay": 21,
      "prerequisiteText": "D21, C14",
      "comparisonInput": "정화 전후 2쌍+환경 2종",
      "cost": {
        "general": 8,
        "metal": 6,
        "signal": 8,
        "specialist": 10
      },
      "durationSeconds": 100,
      "unlockText": "정화 촉매, FAC-P05 효율",
      "stateMachine": [
        "HIDDEN",
        "OBSERVABLE",
        "HYPOTHESIZED",
        "READY",
        "QUEUED",
        "PROCESSING",
        "PAUSED",
        "ANALYZED",
        "UNLOCKED",
        "MASTERED"
      ],
      "raw": [
        "RS-D21-MOBILE-PURIFY",
        "D21, C14",
        "정화 전후 2쌍+환경 2종",
        "8/6/8/10, 100초",
        "정화 촉매, FAC-P05 효율"
      ]
    },
    {
      "id": "RS-D23-MUTATION-MAP",
      "costId": "RCOST-RS-D23-MUTATION-MAP",
      "sourceDocumentId": "RESEARCH-001",
      "enabled": true,
      "minimumDay": 23,
      "prerequisiteText": "D23, C16",
      "comparisonInput": "변이 3범주·2출처",
      "cost": {
        "general": 6,
        "metal": 8,
        "signal": 10,
        "specialist": 12
      },
      "durationSeconds": 120,
      "unlockText": "변이 충돌표, 정제 변이 파편",
      "stateMachine": [
        "HIDDEN",
        "OBSERVABLE",
        "HYPOTHESIZED",
        "READY",
        "QUEUED",
        "PROCESSING",
        "PAUSED",
        "ANALYZED",
        "UNLOCKED",
        "MASTERED"
      ],
      "raw": [
        "RS-D23-MUTATION-MAP",
        "D23, C16",
        "변이 3범주·2출처",
        "6/8/10/12, 120초",
        "변이 충돌표, 정제 변이 파편"
      ]
    },
    {
      "id": "RS-D25-AUGMENT-RESONANCE",